{
  "name": "policy-TwitterJson-Cassandra",
  "description": "policy-TwitterJson-Cassandra",
  "sparkStreamingWindow": 6000,
  "checkpointPath": "checkpoint",
  "rawData": {
    "enabled": "false",
    "path": "myTestParquetPath"
  },
  "input": {
    "name": "in-twitter-json",
    "type": "TwitterJson",
    "configuration": {
      "consumerKey": "*********",
      "consumerSecret": "*********",
      "accessToken": "*********",
      "accessTokenSecret": "*********"
    }
  },
  "transformations": [
    {
      "name": "morphline",
      "order": 0,
      "type": "Morphlines",
      "outputFields": [
        "text",
        "source",
        "hashtags",
        "retweets"
      ],
      "configuration": {
        "morphline": {
          "id": "test1",
          "importCommands": [
            "org.kitesdk.**"
          ],
          "commands": [
            {
              "readJson": {}
            },
            {
              "extractJsonPaths": {
                "paths": {
                  "text": "/text",
                  "source": "/source",
                  "hashtag": "/hashtagEntities[]/text",
                  "retweets": "/retweetCount"
                }
              }
            },
            {
              "removeFields": {
                "blacklist": [
                  "literal:_attachment_body"
                ]
              }
            }
          ]
        }
      }
    }
  ],
  "cubes": [
    {
      "name": "testCube",
      "checkpointConfig": {
        "timeDimension": "minute",
        "granularity": "minute",
        "interval": 30000,
        "timeAvailability": 60000
      },
      "dimensions": [
        {
          "field": "retweets",
          "name": "rtws"
        }
      ],
      "operators": [
        {
          "name": "total",
          "type": "Count",
          "configuration": {}
        }
      ]
    }
  ],
  "outputs": [
    {
      "name": "out-cassandra",
      "type": "Cassandra",
      "configuration": {
        "connectionHost": "127.0.0.1",
        "connectionPort": "9042",
        "cluster": "Test Cluster",
        "keyspace": "sparkta"
      }
    }
  ]
}