{
  "name": "ATSocketCassandra",
  "description": "No description",
  "sparkStreamingWindow": 10000,
  "checkpointPath": "checkpoint",
  "rawData": {
    "enabled": "false",
    "path": ""
  },
  "input":
  {
    "name": "in-socket",
    "type": "Socket",
    "configuration": {
      "hostname": "localhost",
      "port": "10666"
    }
  }
,
  "transformations": [
    {
      "name": "morphline-parser",
      "order": 0,
      "type": "Morphlines",
      "outputFields": [
        "product",
        "price",
        "text"
      ],
      "configuration": {
        "morphline": {
          "id": "morphline1",
          "importCommands": [
            "org.kitesdk.**"
          ],
          "commands": [
            {
              "readCSV": {
                "separator": ",",
                "columns": [
                  "product",
                  "price",
                  "text"
                ],
                "trim": "true",
                "charset": "UTF-8",
                "quoteChar": "\"",
                "commentPrefix": "#"
              }
            }
          ]
        }
      }
    },
    {
      "name": "timestamp",
      "order": 1,
      "type": "DateTime",
      "outputFields": [
        "timestamp"
      ],
      "configuration": {
        "inputFormat": "autoGenerated"
      }
    }
  ],
  "cubes": [
    {
      "name": "testCubeWithTime",
      "checkpointConfig": {
        "timeDimension": "minute",
        "granularity": "minute",
        "interval": 100000,
        "timeAvailability": 90000
      },
      "dimensions": [
        {
          "name": "product",
          "field": "product"
        }
      ],
      "operators": [
        {
          "name": "avg_price",
          "type": "Avg",
          "configuration": {
            "inputField": "price"
          }
        },
        {
          "name": "count_price",
          "type": "Count",
          "configuration": {}
        },
        {
          "name": "first_price",
          "type": "FirstValue",
          "configuration": {
            "inputField": "price"
          }
        },
        {
          "name": "fulltext_price",
          "type": "FullText",
          "configuration": {
            "inputField": "price"
          }
        },
        {
          "name": "last_price",
          "type": "LastValue",
          "configuration": {
            "inputField": "price"
          }
        },
        {
          "name": "max_price",
          "type": "Max",
          "configuration": {
            "inputField": "price"
          }
        },
        {
          "name": "median_price",
          "type": "Median",
          "configuration": {
            "inputField": "price"
          }
        },
        {
          "name": "min_price",
          "type": "Min",
          "configuration": {
            "inputField": "price"
          }
        },
        {
          "name": "range_price",
          "type": "Range",
          "configuration": {
            "inputField": "price"
          }
        },
        {
          "name": "stddev_price",
          "type": "Stddev",
          "configuration": {
            "inputField": "price"
          }
        },
        {
          "name": "sum_price",
          "type": "Sum",
          "configuration": {
            "inputField": "price"
          }
        },
        {
          "name": "variance_price",
          "type": "Variance",
          "configuration": {
            "inputField": "price"
          }
        },
        {
          "name": "entitycount_text",
          "type": "EntityCount",
          "configuration": {
            "inputField": "text",
            "split": " "
          }
        },
        {
          "name": "totalentity_text",
          "type": "TotalEntityCount",
          "configuration": {
            "inputField": "text",
            "split": " "
          }
        }
      ]
    },
    {
      "name": "testCubeWithoutTime",
      "checkpointConfig": {
        "timeDimension": "none",
        "granularity": "minute",
        "interval": 100000,
        "timeAvailability": 90000
      },
      "dimensions": [
        {
          "name": "product",
          "field": "product"
        }
      ],
      "operators": [
        {
          "name": "avg_price",
          "type": "Avg",
          "configuration": {
            "inputField": "price"
          }
        },
        {
          "name": "count_price",
          "type": "Count",
          "configuration": {}
        },
        {
          "name": "first_price",
          "type": "FirstValue",
          "configuration": {
            "inputField": "price"
          }
        },
        {
          "name": "fulltext_price",
          "type": "FullText",
          "configuration": {
            "inputField": "price"
          }
        },
        {
          "name": "last_price",
          "type": "LastValue",
          "configuration": {
            "inputField": "price"
          }
        },
        {
          "name": "max_price",
          "type": "Max",
          "configuration": {
            "inputField": "price"
          }
        },
        {
          "name": "median_price",
          "type": "Median",
          "configuration": {
            "inputField": "price"
          }
        },
        {
          "name": "min_price",
          "type": "Min",
          "configuration": {
            "inputField": "price"
          }
        },
        {
          "name": "range_price",
          "type": "Range",
          "configuration": {
            "inputField": "price"
          }
        },
        {
          "name": "stddev_price",
          "type": "Stddev",
          "configuration": {
            "inputField": "price"
          }
        },
        {
          "name": "sum_price",
          "type": "Sum",
          "configuration": {
            "inputField": "price"
          }
        },
        {
          "name": "variance_price",
          "type": "Variance",
          "configuration": {
            "inputField": "price"
          }
        },
        {
          "name": "entitycount_text",
          "type": "EntityCount",
          "configuration": {
            "inputField": "text",
            "split": " "
          }
        },
        {
          "name": "totalentity_text",
          "type": "TotalEntityCount",
          "configuration": {
            "inputField": "text",
            "split": " "
          }
        }
      ]
    }
  ],
  "outputs": [
    {
      "name": "out-cassandra",
      "type": "Cassandra",
      "configuration": {
        "connectionHost": "127.0.0.1",
        "connectionPort": "9142",
        "cluster": "Test Cluster",
        "keyspace": "sparkta",
        "sparkProperties": [
          {
            "sparkPropertyKey": "spark.cassandra.connection.keep_alive_ms",
            "sparkPropertyValue": "180000"
          }
        ]
      }
    }
  ]
}
