{
  "name": "twitter-stratio-example",
  "description": "twitter-stratio-example",
  "sparkStreamingWindow": 6000,
  "checkpointPath": "checkpoint",
  "rawData": {
    "enabled": "false",

    "path": "myTestParquetPath"
  },
  "input": {
    "name": "in-twitter-json",
    "type": "TwitterJson",
    "configuration": {
      "consumerKey": "****",
      "consumerSecret": "****",
      "accessToken": "****",
      "accessTokenSecret": "****",
      "termsOfSearch": "Stratio,#Stratio"
    }
  },
  "transformations": [
    {
      "name": "morphline",
      "order": 0,
      "type": "Morphlines",
      "outputFields": [
        "text"
      ],
      "configuration": {
        "morphline": {
          "id": "test1",
          "importCommands": [
            "org.kitesdk.**"
          ],
          "commands": [
            {
              "readJson": {}
            },
            {
              "extractJsonPaths": {
                "paths": {
                  "text": "/text"
               }
              }
            },
            {
              "removeFields": {
                "blacklist": [
                  "literal:_attachment_body"
                ]
              }
            }
          ]
        }
      }
    }
  ],
  "cubes": [
    {
      "name": "testCube",
      "checkpointConfig": {
        "timeDimension": "minute",
        "granularity": "minute",
        "interval": 30000,
        "timeAvailability": 60000
      },
      "dimensions": [
        {
          "field": "text",
          "name": "text"
        }
      ],
      "operators": [
        {
          "name": "total",
          "type": "Count",
          "configuration": {}
        }
      ]
    }
  ],
  "outputs": [
    {
      "name": "out-mongo",
      "type": "MongoDb",
      "configuration": {
        "hosts": [{"host": "localhost" , "port": "27017" }],
        "dbName": "sparkta"
      }
    }
  ]
}